{
    "results": [
        {
            "id": "505f05ac-0600-48e0-98dd-9b1036766c20",
            "name": "Article 1",
            "type": "article",
            "children": {
                "id": "9c7164e2-dcda-4e58-a7e1-677a7236415c",
                "name": "Verse 1",
                "number": "(1)",
                "type": "verse",
                "content": "Negara Republik Indonesia melakukan penambahan\npenyertaan modal ke dalam modal saham Perusahaan\nPerseroan (Persero) PT Perkebunan Nusantara III yang\ndidirikan berdasarkan Peraturan Pemerintah Nomor 8 Tahun\n1996 tentang Peleburan Perusahaan Perseroan (Persero) PT\nPerkebunan III, Perusahaan Perseroan (Persero) PT\nPerkebunan IV, dan Perusahaan Perseroan (Persero) PT\nPerkebunan V menjadi Perusahaan Perseroan (Persero) PT\nPerkebunan Nusantara III.",
                "explanation": "Tidak ada Penjelasan"
            }
        },
        {
            "id": "5dae0469-16e0-490c-8fc1-f9247cb79976",
            "name": "Article 2",
            "type": "article",
            "children": {
                "id": "68e49a5a-b081-40db-844a-d3c4a8c3d4c7",
                "name": "Verse 1",
                "number": "(1)",
                "type": "verse",
                "content": "(1) Nilai penambahan penyertaan modal Negara\nsebagaimana dimaksud dalam Pasal 1 sebesar\nRp3.150.000.000.000,00 (tiga triliun seratus lima puluh\nmiliar rupiah).\n(2) Penambahan penyertaan modal Negara sebagaimana\ndimaksud pada ayat (1) diteruskan sebagai penambahan\nmodal kepada:\na. PT Perkebunan Nusantara VII sebesar\nRp157.500.000.000,00 (seratus lima puluh tujuh\nmiliar lima ratus juta rupiah);\nb. PT Perkebunan Nusantara IX sebesar Rp\n900.000.000.000,00 (sembilan ratus miliar rupiah);\nc. PT Perkebunan Nusantara X sebesar Rp\n877.500.000.000,00 (delapan ratus tujuh puluh\ntujuh miliar lima ratus juta rupiah);\nd. PT Perkebunan Nusantara XI sebesar Rp\n585.000.000.000,00 (lima ratus delapan puluh lima\nmiliar rupiah); dan\ne. PT Perkebunan Nusantara XII sebesar Rp\n630.000.000.000,00 (enam ratus tiga puluh miliar\nrupiah).\n(3) Penambahan penyertaan modal Negara sebagaimana\ndimaksud pada ayat (1) bersumber dari Anggaran\nPendapatan dan Belanja Negara Tahun Anggaran 2015.",
                "explanation": "Tidak ada Penjelasan"
            }
        },
        {
            "id": "fb18f1b3-38f2-4e01-b043-9596281dd155",
            "name": "Article 3",
            "type": "article",
            "children": {
                "id": "7c197d67-d248-4a1f-8279-93364c522fc7",
                "name": "Verse 1",
                "number": "(1)",
                "type": "verse",
                "content": "Peraturan Pemerintah ini mulai berlaku pada tanggal\ndiundangkan.\nAgar setiap orang mengetahuinya, memerintahkan\npengundangan Peraturan Pemerintah ini dengan\npenempatannya dalam Lembaran Negara Republik\nIndonesia.",
                "explanation": "Tidak ada Penjelasan"
            }
        }
    ],
    "metadata": {
        "Nomor": "135",
        "Tahun": "2015",
        "Tentang": "PENAMBAHAN PENYERTAAN MODAL NEGARA REPUBLIK INDONESIA\nKE DALAM MODAL SAHAM PERUSAHAAN PERSEROAN (PERSERO)\nPT PERKEBUNAN NUSANTARA III",
        "Menimbang": {
            "Introduction": "",
            "a": " bahwa untuk memperbaiki struktur permodalan dan\nmeningkatkan kapasitas usaha Perusahaan Perseroan\n(Persero) PT Perkebunan Nusantara III dalam rangka\nmendukung program industri gula nasional melalui PT\nPerkebunan Nusantara VII, PT Perkebunan Nusantara\nIX, PT Perkebunan Nusantara X, PT Perkebunan\nNusantara XI, dan PT Perkebunan Nusantara XII, perlu\nmelakukan penambahan penyertaan modal Negara\nRepublik Indonesia ke dalam modal saham Perusahaan\nPerseroan (Persero) PT Perkebunan Nusantara III yang\nbersumber dari Anggaran Pendapatan dan Belanja\nNegara Tahun Anggaran 2015;",
            "b": " bahwa berdasarkan pertimbangan sebagaimana\ndimaksud dalam huruf a dan untuk melaksanakan\nketentuan Pasal 4 ayat (4) Undang-Undang Nomor 19\nTahun 2003 tentang Badan Usaha Milik Negara, perlu\nmenetapkan Peraturan Pemerintah tentang"
        },
        "Mengingat": {
            "Introduction": "",
            "1": " Pasal 5 ayat (2) Undang-Undang Dasar Negara Republik\nIndonesia Tahun 1945;",
            "2": " Undang-Undang Nomor 19 Tahun 2003 tentang Badan\nUsaha Milik Negara (Lembaran Negara Republik\nIndonesia Tahun 2003 Nomor 70, Tambahan Lembaran\nNegara Republik Indonesia Nomor 4297);",
            "3": " Undang-Undang Nomor 1 Tahun 2004 tentang\nPerbendaharaan Negara (Lembaran Negara Republik\nIndonesia Tahun 2004 Nomor 5, Tambahan Lembaran\nNegara Republik Indonesia Nomor 4355);",
            "4": " Undang-Undang Nomor 27 Tahun 2014 tentang\nAnggaran Pendapatan dan Belanja Negara Tahun\nAnggaran 2015 (Lembaran Negara Republik Indonesia\nTahun 2014 Nomor 259, Tambahan Lembaran Negara\nRepublik Indonesia Nomor 5593) sebagaimana telah\ndiubah dengan Undang-Undang Nomor 3 Tahun 2015\ntentang Perubahan atas Undang-Undang Nomor 27\nTahun 2014 tentang Anggaran Pendapatan dan Belanja\nNegara Tahun Anggaran 2015 (Lembaran Negara\nRepublik Indonesia Tahun 2015 Nomor 44, Tambahan\nLembaran Negara Republik Indonesia Nomor 5669);",
            "5": " Peraturan Pemerintah Nomor 44 Tahun 2005 tentang\nTata Cara Penyertaan dan Penatausahaan Modal\nNegara pada Badan Usaha Milik Negara dan Perseroan\nTerbatas (Lembaran Negara Republik Indonesia Tahun\n2005 Nomor 116, Tambahan Lembaran Negara\nRepublik Indonesia Nomor 4555);"
        },
        "Menetapkan": "\nPeraturan Pemerintah tentang\nMengingat \n1. Pasal 5 ayat (2) Undang-Undang Dasar Negara Republik\nIndonesia Tahun 1945;\n2. Undang-Undang Nomor 19 Tahun 2003 tentang Badan\nUsaha Milik Negara (Lembaran Negara Republik\nIndonesia Tahun 2003 Nomor 70, Tambahan Lembaran\nNegara Republik Indonesia Nomor 4297);\n3. Undang-Undang Nomor 1 Tahun 2004 tentang\nPerbendaharaan Negara (Lembaran Negara Republik\nIndonesia Tahun 2004 Nomor 5, Tambahan Lembaran\nNegara Republik Indonesia Nomor 4355);\n4. Undang-Undang Nomor 27 Tahun 2014 tentang\nAnggaran Pendapatan dan Belanja Negara Tahun\nAnggaran 2015 (Lembaran Negara Republik Indonesia\nTahun 2014 Nomor 259, Tambahan Lembaran Negara\nRepublik Indonesia Nomor 5593) sebagaimana telah\ndiubah dengan Undang-Undang Nomor 3 Tahun 2015\ntentang Perubahan atas Undang-Undang Nomor 27\nTahun 2014 tentang Anggaran Pendapatan dan Belanja\nNegara Tahun Anggaran 2015 (Lembaran Negara\nRepublik Indonesia Tahun 2015 Nomor 44, Tambahan\nLembaran Negara Republik Indonesia Nomor 5669);\n5. Peraturan Pemerintah Nomor 44 Tahun 2005 tentang\nTata Cara Penyertaan dan Penatausahaan Modal\nNegara pada Badan Usaha Milik Negara dan Perseroan\nTerbatas (Lembaran Negara Republik Indonesia Tahun\n2005 Nomor 116, Tambahan Lembaran Negara\nRepublik Indonesia Nomor 4555);\nMEMUTUSKAN\nMenetapkan  PERATURAN PEMERINTAH TENTANG PENAMBAHAN\nPENYERTAAN MODAL NEGARA REPUBLIK INDONESIA KE\nDALAM MODAL SAHAM PERUSAHAAN PERSEROAN\n(PERSERO) PT PERKEBUNAN NUSANTARA III.\n2015, No.358",
        "tanggal sah": "28 Desember 2015"
    }
}