{
    "results": [
        {
            "id": "8c545e19-d675-41d6-ada3-76b462d8a2e2",
            "name": "Article 1",
            "type": "article",
            "children": {
                "id": "8aed23f7-2275-4b58-ab9c-3095dca22216",
                "name": "Verse 1",
                "number": "(1)",
                "type": "verse",
                "content": "Negara Republik Indonesia melakukan penambahan\npenyertaan modal ke dalam modal saham Perusahaan\nPerseroan (Persero) PT Perusahaan Listrik Negara yang\n2016, No.103\nstatusnya sebagai Perusahaan Perseroan (Persero)\nditetapkan berdasarkan Peraturan Pemerintah Nomor 23\nTahun 1994 tentang Pengalihan Bentuk Perusahaan\nUmum (Perum) Listrik Negara menjadi Perusahaan\nPerseroan (Persero).",
                "explanation": "Tidak ada Penjelasan"
            }
        },
        {
            "id": "be90395a-54c1-445c-8e88-936d1c92e25b",
            "name": "Article 2",
            "type": "article",
            "children": {
                "id": "3500102e-7909-4c51-9e7b-c6a3df0a5c47",
                "name": "Verse 1",
                "number": "(1)",
                "type": "verse",
                "content": "(1) Nilai penambahan penyertaan modal Negara\nsebagaimana dimaksud dalam Pasal 1 sebesar\nRp8.860.208.058.288,00 (delapan triliun delapan ratus\nenam puluh miliar dua ratus delapan juta lima puluh\ndelapan ribu dua ratus delapan puluh delapan rupiah).\n(2) Penambahan penyertaan modal Negara sebagaimana\ndimaksud pada ayat (1) berasal dari pengalihan Barang\nMilik Negara pada Kementerian Energi dan Sumber\nDaya Mineral yang pengadaannya bersumber dari\nAnggaran Pendapatan dan Belanja Negara Tahun\nAnggaran 1994/1995, 1995/1996, 1996/1997,\n1997/1998, 1998/1999, 1999/2000, 2000, 2001,\n2002, 2003, 2004, 2005, 2006, dan 2007 dengan\nrincian sebagaimana tercantum dalam Lampiran yang\nmerupakan bagian tidak terpisahkan dari Peraturan\nPemerintah ini.",
                "explanation": "Tidak ada Penjelasan"
            }
        },
        {
            "id": "dc5cbbfc-3aa5-4ca3-9b0f-7c9518710db7",
            "name": "Article 3",
            "type": "article",
            "children": {
                "id": "e00e0e9f-b0f9-411a-ac52-dd006fb25209",
                "name": "Verse 1",
                "number": "(1)",
                "type": "verse",
                "content": "Peraturan Pemerintah ini mulai berlaku pada tanggal\ndiundangkan.\nAgar setiap orang mengetahuinya, memerintahkan pengundangan Peraturan Pemerintah ini dengan penempatannya dalam Lembaran Negara Republik Indonesia.",
                "explanation": "Tidak ada Penjelasan"
            }
        }
    ],
    "metadata": {
        "Nomor": "16",
        "Tahun": "2016",
        "Tentang": "PENAMBAHAN PENYERTAAN MODAL NEGARA REPUBLIK INDONESIA\nKE DALAM MODAL SAHAM PERUSAHAAN PERSEROAN (PERSERO)\nPT PERUSAHAAN LISTRIK NEGARA",
        "Menimbang": {
            "Introduction": "",
            "a": " bahwa untuk memperbaiki struktur permodalan dan meningkatkan kapasitas usaha Perusahaan Perseroan (Persero) PT Perusahaan Listrik Negara, perlu melakukan penambahan penyertaan modal Negara Republik Indonesia ke dalam modal saham Perusahaan Perseroan (Persero) PT Perusahaan Listrik Negara yang berasal dari pengalihan Barang Milik Negara pada Kementerian Energi dan Sumber Daya Mineral yang pengadaannya bersumber dari Anggaran Pendapatan dan Belanja Negara Tahun Anggaran 1994/1995, 1995/1996, 1996/1997, 1997/1998, 1998/1999, 1999/2000, 2000, 2001, 2002, 2003, 2004, 2005, 2006, dan 2007;",
            "b": " bahwa berdasarkan pertimbangan sebagaimana dimaksud dalam huruf a dan untuk melaksanakan ketentuan Pasal 4 ayat (4) Undang-Undang Nomor 19 Tahun 2003 tentang Badan Usaha Milik Negara, perlu\nmenetapkan Peraturan Pemerintah tentang\nPenambahan Penyertaan Modal Negara Republik\nIndonesia ke dalam Modal Saham Perusahaan\nPerseroan (Persero) PT Perusahaan Listrik Negara;"
        },
        "Mengingat": {
            "Introduction": "",
            "1": " Pasal 5 ayat (2) Undang-Undang Dasar Negara\nRepublik Indonesia Tahun 1945;",
            "2": " Undang-Undang Nomor 19 Tahun 2003 tentang Badan\nUsaha Milik Negara (Lembaran Negara Republik\nIndonesia Tahun 2003 Nomor 70, Tambahan Lembaran\nNegara Republik Indonesia Nomor 4297);",
            "3": " Undang-Undang Nomor 1 Tahun 2004 tentang\nPerbendaharaan Negara (Lembaran Negara Republik\nIndonesia Tahun 2004 Nomor 5, Tambahan Lembaran\nNegara Republik Indonesia Nomor 4355);",
            "4": " Undang-Undang Nomor 14 Tahun 2015 tentang\nAnggaran Pendapatan dan Belanja Negara Tahun\nAnggaran 2016 (Lembaran Negara Republik Indonesia\nTahun 2015 Nomor 278, Tambahan Lembaran Negara\nRepublik Indonesia Nomor 5767);",
            "5": " Peraturan Pemerintah Nomor 44 Tahun 2005 tentang\nTata Cara Penyertaan dan Penatausahaan Modal\nNegara pada Badan Usaha Milik Negara dan Perseroan\nTerbatas (Lembaran Negara Republik Indonesia Tahun\n2005 Nomor 116, Tambahan Lembaran Negara\nRepublik Indonesia Nomor 4555);"
        },
        "Menetapkan": "\nPeraturan Pemerintah tentang\nPenambahan Penyertaan Modal Negara Republik\nIndonesia ke dalam Modal Saham Perusahaan\nPerseroan (Persero) PT Perusahaan Listrik Negara;\nMengingat \n1. Pasal 5 ayat (2) Undang-Undang Dasar Negara\nRepublik Indonesia Tahun 1945;\n2. Undang-Undang Nomor 19 Tahun 2003 tentang Badan\nUsaha Milik Negara (Lembaran Negara Republik\nIndonesia Tahun 2003 Nomor 70, Tambahan Lembaran\nNegara Republik Indonesia Nomor 4297);\n3. Undang-Undang Nomor 1 Tahun 2004 tentang\nPerbendaharaan Negara (Lembaran Negara Republik\nIndonesia Tahun 2004 Nomor 5, Tambahan Lembaran\nNegara Republik Indonesia Nomor 4355);\n4. Undang-Undang Nomor 14 Tahun 2015 tentang\nAnggaran Pendapatan dan Belanja Negara Tahun\nAnggaran 2016 (Lembaran Negara Republik Indonesia\nTahun 2015 Nomor 278, Tambahan Lembaran Negara\nRepublik Indonesia Nomor 5767);\n5. Peraturan Pemerintah Nomor 44 Tahun 2005 tentang\nTata Cara Penyertaan dan Penatausahaan Modal\nNegara pada Badan Usaha Milik Negara dan Perseroan\nTerbatas (Lembaran Negara Republik Indonesia Tahun\n2005 Nomor 116, Tambahan Lembaran Negara\nRepublik Indonesia Nomor 4555);\nMEMUTUSKAN\nMenetapkan \nPERATURAN PEMERINTAH TENTANG PENAMBAHAN\nPENYERTAAN MODAL NEGARA REPUBLIK INDONESIA KE\nDALAM MODAL SAHAM PERUSAHAAN PERSEROAN\n(PERSERO) PT PERUSAHAAN LISTRIK NEGARA.",
        "tanggal sah": "25 Mei 2016"
    }
}