{
    "results": [
        {
            "id": "5e930b22-0b75-4ae3-bf21-530ee5ef3c52",
            "name": "Article 1",
            "type": "article",
            "children": {
                "id": "e7d68fb2-9fda-4939-843c-12745042ca64",
                "name": "Verse 1",
                "number": "(1)",
                "type": "verse",
                "content": "Negara Republik Indonesia melakukan penambahan\npenyertaan modal ke dalam modal saham Perusahaan\nPerseroan (Persero) PT Bahana Pembinaan Usaha Indonesia\nyang didirikan berdasarkan Peraturan Pemerintah Nomor\n18 Tahun 1973 tentang Penyertaan Modal Negara Republik\nIndonesia untuk Pendirian Perusahaan Perseroan dalam\nBidang Pengembangan Usaha Swasta Nasional\nsebagaimana telah diubah dengan Peraturan Pemerintah\nNomor 15 Tahun 2020 tentang Perubahan Atas Peraturan\nPemerintah Nomor 18 Tahun 1973 tentang Penyertaan\nModal Negara Republik Indonesia untuk Pendirian\nPerusahaan Perseroan dalam Bidang Pengembangan Usaha\nSwasta Nasional.",
                "explanation": "Tidak ada Penjelasan"
            }
        },
        {
            "id": "a4bffa1b-9149-4649-bd1f-25cc90a20e69",
            "name": "Article 2",
            "type": "article",
            "children": {
                "id": "825eb022-421c-4117-bdc5-d9f59b0cbcdc",
                "name": "Verse 1",
                "number": "(1)",
                "type": "verse",
                "content": "(1) Nilai penambahan penyertaan modal negara\nsebagaimana dimaksud dalam Pasal 1 sebesar\nRp20.000.000.000.000,00 (dua puluh triliun rupiah).\n(2) Penambahan penyertaan modal negara sebagaimana\ndimaksud pada ayat (1) selanjutnya diteruskan\nseluruhnya menjadi penambahan penyertaan modal\nPerusahaan Perseroan (Persero) PT Bahana Pembinaan\nUsaha Indonesia ke dalam modal saham PT Asuransi\nJiwa IFG.\n(3) Penambahan penyertaan modal negara sebagaimana\ndimaksud pada ayat (1) bersumber dari Anggaran\nPendapatan dan Belanja Negara Tahun Anggaran\n2021.",
                "explanation": "Tidak ada Penjelasan"
            }
        },
        {
            "id": "03504f4a-9741-4cfc-88b9-f60424ac7b15",
            "name": "Article 3",
            "type": "article",
            "children": {
                "id": "c038582f-855e-4d10-8757-12a3abaa611f",
                "name": "Verse 1",
                "number": "(1)",
                "type": "verse",
                "content": "Peraturan Pemerintah ini mulai berlaku pada tanggal\ndiundangkan.\nAgar setiap orang mengetahuinya, memerintahkan\npengundangan Peraturan Pemerintah ini dengan\npenempatannya dalam Lembaran Negara Republik\nIndonesia.",
                "explanation": "Tidak ada Penjelasan"
            }
        }
    ],
    "metadata": {
        "Nomor": "102",
        "Tahun": "2021",
        "Tentang": "PENAMBAHAN PENYERTAAN MODAL NEGARA REPUBLIK INDONESIA\nKE DALAM MODAL SAHAM PERUSAHAAN PERSEROAN (PERSERO)\nPT BAHANA PEMBINAAN USAHA INDONESIA",
        "Menimbang": {
            "Introduction": "",
            "a": " bahwa untuk memperbaiki struktur permodalan dan\nmeningkatkan kapasitas usaha Perusahaan Perseroan\n(Persero) PT Bahana Pembinaan Usaha Indonesia\ndalam rangka mendukung penguatan industri\nasuransi Indonesia termasuk penyelesaian polis PT\nAsuransi Jiwasraya (Persero) yang telah\ndirestrukturisasi dan/atau dialihkan kepada PT\nAsuransi Jiwa IFG, perlu melakukan penambahan\npenyertaan modal Negara Republik Indonesia ke dalam\nmodal saham Perusahaan Perseroan (Persero) PT\nBahana Pembinaan Usaha Indonesia yang bersumber\ndari Anggaran Pendapatan dan Belanja Negara Tahun\nAnggaran 2021;",
            "b": " bahwa berdasarkan pertimbangan sebagaimana\ndimaksud dalam huruf a dan untuk melaksanakan\nketentuan Pasal 4 ayat (4) Undang-Undang Nomor 19\nTahun 2003 tentang Badan Usaha Milik Negara\nsebagaimana telah diubah dengan Undang-Undang\nNomor 11 Tahun 2020 tentang Cipta Kerja, perlu\nmenetapkan Peraturan Pemerintah tentang\nPenambahan Penyertaan Modal Negara Republik\nIndonesia ke Dalam Modal Saham Perusahaan\nPerseroan (Persero) PT Bahana Pembinaan Usaha\nIndonesia;"
        },
        "Mengingat": {
            "Introduction": "",
            "1": " Pasal 5 ayat (2) Undang-Undang Dasar Negara\nRepublik Indonesia Tahun 1945;",
            "2": " Undang-Undang Nomor 19 Tahun 2003 tentang Badan\nUsaha Milik Negara (Lembaran Negara Republik\nIndonesia Tahun 2003 Nomor 70, Tambahan\nLembaran Negara Republik Indonesia Nomor 4297)\nsebagaimana telah diubah dengan Undang-Undang\nNomor 11 Tahun 2020 tentang Cipta Kerja (Lembaran\nNegara Republik Indonesia Tahun 2020 Nomor 245,\nTambahan Lembaran Negara Republik Indonesia\nNomor 6573);",
            "3": " Undang-Undang Nomor 1 Tahun 2004 tentang\nPerbendaharaan Negara (Lembaran Negara Republik\nIndonesia Tahun 2004 Nomor 5, Tambahan Lembaran\nNegara Republik Indonesia Nomor 4355);",
            "4": " Undang-Undang Nomor 40 Tahun 2014 tentang\nPerasuransian (Lembaran Negara Republik Indonesia\nTahun 2014 Nomor 337, Tambahan Lembaran Negara\nRepublik Indonesia Nomor 5618);",
            "5": " Undang-Undang Nomor 9 Tahun 2020 tentang\nAnggaran Pendapatan dan Belanja Negara Tahun\nAnggaran 2021 (Lembaran Negara Republik Indonesia\nTahun 2020 Nomor 239, Tambahan Lembaran Negara\nRepublik Indonesia Nomor 6570);",
            "6": " Peraturan Pemerintah Nomor 44 Tahun 2005 tentang\nTata Cara Penyertaan dan Penatausahaan Modal\nNegara pada Badan Usaha Milik Negara dan Perseroan\nTerbatas (Lembaran Negara Republik Indonesia Tahun\n2005 Nomor 116, Tambahan Lembaran Negara"
        },
        "Menetapkan": "\nPeraturan Pemerintah tentang\nPenambahan Penyertaan Modal Negara Republik\nIndonesia ke Dalam Modal Saham Perusahaan\nPerseroan (Persero) PT Bahana Pembinaan Usaha\nIndonesia;\nMengingat  1. Pasal 5 ayat (2) Undang-Undang Dasar Negara\nRepublik Indonesia Tahun 1945;\n2. Undang-Undang Nomor 19 Tahun 2003 tentang Badan\nUsaha Milik Negara (Lembaran Negara Republik\nIndonesia Tahun 2003 Nomor 70, Tambahan\nLembaran Negara Republik Indonesia Nomor 4297)\nsebagaimana telah diubah dengan Undang-Undang\nNomor 11 Tahun 2020 tentang Cipta Kerja (Lembaran\nNegara Republik Indonesia Tahun 2020 Nomor 245,\nTambahan Lembaran Negara Republik Indonesia\nNomor 6573);\n3. Undang-Undang Nomor 1 Tahun 2004 tentang\nPerbendaharaan Negara (Lembaran Negara Republik\nIndonesia Tahun 2004 Nomor 5, Tambahan Lembaran\nNegara Republik Indonesia Nomor 4355);\n4. Undang-Undang Nomor 40 Tahun 2014 tentang\nPerasuransian (Lembaran Negara Republik Indonesia\nTahun 2014 Nomor 337, Tambahan Lembaran Negara\nRepublik Indonesia Nomor 5618);\n5. Undang-Undang Nomor 9 Tahun 2020 tentang\nAnggaran Pendapatan dan Belanja Negara Tahun\nAnggaran 2021 (Lembaran Negara Republik Indonesia\nTahun 2020 Nomor 239, Tambahan Lembaran Negara\nRepublik Indonesia Nomor 6570);\n6. Peraturan Pemerintah Nomor 44 Tahun 2005 tentang\nTata Cara Penyertaan dan Penatausahaan Modal\nNegara pada Badan Usaha Milik Negara dan Perseroan\nTerbatas (Lembaran Negara Republik Indonesia Tahun\n2005 Nomor 116, Tambahan Lembaran Negara\nMEMUTUSKAN\nMenetapkan PERATURAN PEMERINTAH TENTANG PENAMBAHAN\nPENYERTAAN MODAL NEGARA REPUBLIK INDONESIA KE\nDALAM MODAL SAHAM PERUSAHAAN PERSEROAN\n(PERSERO) PT BAHANA PEMBINAAN USAHA INDONESIA.",
        "tanggal sah": "6 Oktober 2021"
    }
}