{
    "results": [
        {
            "id": "cf051ddd-c3a8-4328-a1a3-8153997ed519",
            "name": "Article 1",
            "type": "article",
            "children": {
                "id": "466b911b-8b37-454b-9077-5f8e62de6581",
                "name": "Verse 1",
                "number": "(1)",
                "type": "verse",
                "content": "Negara Republik Indonesia melakukan penambahan penyertaan modal ke dalam modal saham Perusahaan Perseroan (Persero) PT Perusahaan Listrik Negara yang statusnya sebagai Perusahaan Perseroan (Persero) ditetapkan berdasarkan Peraturan Pemerintah Nomor 23 Tahun 1994 tentang Pengalihan Bentuk Perusahaan Umum (PERUM) Listrik Negara menjadi Perusahaan Perseroan (PERSERO).",
                "explanation": "Tidak ada Penjelasan"
            }
        },
        {
            "id": "d4317f57-a62f-4f6c-b39c-23129c8afb3b",
            "name": "Article 2",
            "type": "article",
            "children": {
                "id": "0b171507-1fb9-406f-b9fd-ef3e5ae87748",
                "name": "Verse 1",
                "number": "(1)",
                "type": "verse",
                "content": "(1) Nilai penambahan penyertaan modal negara sebagaimana dimaksud dalam Pasal 1 sebesar Rp4.273.196.368.879,00 (empat triliun dua ratus tujuh puluh tiga miliar seratus sembilan puluh enam juta tiga ratus enam puluh delapan ribu delapan ratus tujuh puluh sembilan rupiah).\n(2) Penambahan penyertaan modal negara sebagaimana dimaksud pada ayat (1) berasal dari pengalihan Barang Milik Negara pada Kementerian Energi dan Sumber Daya Mineral yang pengadaannya bersumber dari Anggaran Pendapatan dan Belanja Negara Tahun Anggaran 2009, 2010, 2011, 2012, 2013, dan 2014 dengan rincian sebagaimana tercantum dalam Lampiran yang merupakan bagian tidak terpisahkan dari Peraturan Pemerintah ini.",
                "explanation": "Tidak ada Penjelasan"
            }
        },
        {
            "id": "b2cf8bac-8fb3-41be-9101-b13b580e9813",
            "name": "Article 3",
            "type": "article",
            "children": {
                "id": "eecd834a-f6b8-4120-842d-5ba28ba4e80c",
                "name": "Verse 1",
                "number": "(1)",
                "type": "verse",
                "content": "Peraturan Pemerintah ini mulai berlaku pada tanggal diundangkan.\nAgar . . .\nAgar setiap orang mengetahuinya, memerintahkan pengundangan Peraturan Pemerintah ini dengan penempatannya dalam Lembaran Negara Republik Indonesia.",
                "explanation": "Tidak ada Penjelasan"
            }
        }
    ],
    "metadata": {
        "Nomor": "122",
        "Tahun": "2021",
        "Tentang": "PENAMBAHAN PENYERTAAN MODAL NEGARA REPUBLIK INDONESIA\nKE DALAM MODAL SAHAM PERUSAHAAN PERSEROAN (PERSERO)\nPT PERUSAHAAN LISTRIK NEGARA",
        "Menimbang": {
            "Introduction": "",
            "a": " bahwa untuk memperbaiki struktur permodalan dan\nmeningkatkan kapasitas usaha Perusahaan Perseroan\n(Persero) PT Perusahaan Listrik Negara, perlu melakukan\npenambahan penyertaan modal Negara Republik\nIndonesia ke dalam modal saham Perusahaan Perseroan\n(Persero) PT Perusahaan Listrik Negara yang berasal dari\npengalihan Barang Milik Negara pada Kementerian\nEnergi dan Sumber Daya Mineral yang pengadaannya\nbersumber dari Anggaran Pendapatan dan Belanja\nNegara Tahun Anggaran 2009, 2010, 2011, 2012, 2013,\ndan 2014;",
            "b": " bahwa berdasarkan pertimbangan sebagaimana\ndimaksud dalam huruf a dan untuk melaksanakan\nketentuan Pasal 4 ayat (4) Undang-Undang Nomor 19\nTahun 2003 tentang Badan Usaha Milik Negara, perlu\nmenetapkan Peraturan Pemerintah tentang Penambahan\nPenyertaan Modal Negara Republik Indonesia ke dalam\nModal Saham Perusahaan Perseroan (Persero) PT\nPerusahaan Listrik Negara;"
        },
        "Mengingat": {
            "Introduction": "",
            "1": " Pasal 5 ayat (2) Undang-Undang Dasar Negara Republik\nIndonesia Tahun 1945;",
            "2": " Undang-Undang Nomor 19 Tahun 2003 tentang Badan\nUsaha Milik Negara (Lembaran Negara Republik\nIndonesia Tahun 2003 Nomor 70, Tambahan Lembaran\nNegara Republik Indonesia Nomor 4297);",
            "3": " Undang-Undang Nomor 1 Tahun 2004 tentang\nPerbendaharaan Negara (Lembaran Negara Republik\nIndonesia Tahun 2004 Nomor 5, Tambahan Lembaran\nNegara Republik Indonesia Nomor 4355);",
            "4": " Undang-Undang Nomor 9 Tahun 2020 tentang\nAnggaran Pendapatan dan Belanja Negara Tahun\nAnggaran 2021 (Lembaran Negara Republik Indonesia\nTahun 2020 Nomor 239, Tambahan Lembaran Negara\nRepublik Indonesia Nomor 6570);",
            "5": " Peraturan Pemerintah Nomor 44 Tahun 2005 tentang\nTata Cara Penyertaan dan Penatausahaan Modal Negara\npada Badan Usaha Milik Negara dan Perseroan Terbatas\n(Lembaran Negara Republik Indonesia Tahun 2005\nNomor 116, Tambahan Lembaran Negara Republik\nIndonesia Nomor 4555) sebagaimana telah diubah\ndengan Peraturan Pemerintah Nomor 72 Tahun 2016\ntentang Perubahan atas Peraturan Pemerintah Nomor\n44 Tahun 2005 tentang Tata Cara Penyertaan dan\nPenatausahaan Modal Negara pada Badan Usaha Milik\nNegara dan Perseroan Terbatas (Lembaran Negara\nRepublik Indonesia Tahun 2016 Nomor 325, Tambahan\nLembaran Negara Republik Indonesia Nomor 6006);"
        },
        "Menetapkan": "\nPeraturan Pemerintah tentang Penambahan\nPenyertaan Modal Negara Republik Indonesia ke dalam\nModal Saham Perusahaan Perseroan (Persero) PT\nPerusahaan Listrik Negara;\nMengingat \n1. Pasal 5 ayat (2) Undang-Undang Dasar Negara Republik\nIndonesia Tahun 1945;\n2. Undang-Undang Nomor 19 Tahun 2003 tentang Badan\nUsaha Milik Negara (Lembaran Negara Republik\nIndonesia Tahun 2003 Nomor 70, Tambahan Lembaran\nNegara Republik Indonesia Nomor 4297);\n3. Undang-Undang Nomor 1 Tahun 2004 tentang\nPerbendaharaan Negara (Lembaran Negara Republik\nIndonesia Tahun 2004 Nomor 5, Tambahan Lembaran\nNegara Republik Indonesia Nomor 4355);\n4. Undang-Undang Nomor 9 Tahun 2020 tentang\nAnggaran Pendapatan dan Belanja Negara Tahun\nAnggaran 2021 (Lembaran Negara Republik Indonesia\nTahun 2020 Nomor 239, Tambahan Lembaran Negara\nRepublik Indonesia Nomor 6570);\n5. Peraturan Pemerintah Nomor 44 Tahun 2005 tentang\nTata Cara Penyertaan dan Penatausahaan Modal Negara\npada Badan Usaha Milik Negara dan Perseroan Terbatas\n(Lembaran Negara Republik Indonesia Tahun 2005\nNomor 116, Tambahan Lembaran Negara Republik\nIndonesia Nomor 4555) sebagaimana telah diubah\ndengan Peraturan Pemerintah Nomor 72 Tahun 2016\ntentang Perubahan atas Peraturan Pemerintah Nomor\n44 Tahun 2005 tentang Tata Cara Penyertaan dan\nPenatausahaan Modal Negara pada Badan Usaha Milik\nNegara dan Perseroan Terbatas (Lembaran Negara\nRepublik Indonesia Tahun 2016 Nomor 325, Tambahan\nLembaran Negara Republik Indonesia Nomor 6006);\nMEMUTUSKAN\nMenetapkan PERATURAN PEMERINTAH TENTANG PENAMBAHAN\nPENYERTAAN MODAL NEGARA REPUBLIK INDONESIA\nKE DALAM MODAL SAHAM PERUSAHAAN PERSEROAN\n(PERSERO) PT PERUSAHAAN LISTRIK NEGARA.",
        "tanggal sah": "29 Desember 2021"
    }
}