{
    "results": [
        {
            "id": "27678b03-13b4-4061-b0e0-9080ed7a6843",
            "name": "Article 1",
            "type": "article",
            "children": {
                "id": "a1c2cb70-a5e3-4502-9336-f7455e68fc96",
                "name": "Verse 1",
                "number": "(1)",
                "type": "verse",
                "content": "Negara Republik Indonesia melakukan, penambahan\npenyertaan modal ke dalam modal saham Perusahaan\nPerseroan (Persero) PT Perusahaan Listrik Negara yang\nstatusnya sebagai Perusahaan Perseroan (Persero)\nditetapkan berdasarkan Peraturan Pemerintah Nomor 23\nTahun 1994 tentang Pengalihan Bentuk Perusahaan Umum\n(PERUM) Listrik Negara menjadi Perusahaan Perseroan\n(PERSERO).",
                "explanation": "Tidak ada Penjelasan"
            }
        },
        {
            "id": "68230ff3-ff21-4bc0-893d-5ee1c793cb93",
            "name": "Article 2",
            "type": "article",
            "children": {
                "id": "7e138bf1-3d3b-43b2-a239-985c205ed4da",
                "name": "Verse 1",
                "number": "(1)",
                "type": "verse",
                "content": "(1) Nilai penambahan penyertaan modal Negara\nsebagaimana dimaksud dalam Pasal 1 sebesar\nRp132.967.340.567,00 (seratus tiga puluh dua miliar\nsembilan ratus enam puluh tujuh juta tiga ratus\nempat puluh ribu lima ratus enam puluh tujuh,\nrupiah).\n(2) Penambahan penyertaan modal negara sebagaimana\ndimaksud pada ayat (1) berasal dari pengalihan\nBarang Milik Negara pada Kementerian Energi dan\nSumber Daya Mineral yang pengadaannya bersumber\ndari Anggaran Pendapatan dan Belanja Negara Tahun\nAnggaran 2004, 2005, 2006, dan 2008 dengan rincian\nsebagaimana tercantum dalam Lampiran yang\nmerupakan bagian tidak terpisahkan dari Peraturan\nPemerintah ini.",
                "explanation": "Tidak ada Penjelasan"
            }
        },
        {
            "id": "e88ad5c8-404f-4f3d-8055-d4bba0c00b3b",
            "name": "Article 3",
            "type": "article",
            "children": {
                "id": "702d7aa0-25f2-475a-9c16-2242a53f4399",
                "name": "Verse 1",
                "number": "(1)",
                "type": "verse",
                "content": "Peraturan Pemerintah ini mulai berlaku pada tanggal\ndiundangkan.\nAgar setiap orang mengetahuinya, memerintahkan pengundangan Peraturan Pemerintah ini dengan penempatannya dalam Lembaran Negara Republik Indonesia.",
                "explanation": "Tidak ada Penjelasan"
            }
        }
    ],
    "metadata": {
        "Nomor": "15",
        "Tahun": "2018",
        "Tentang": "PENAMBAHAN PENYERTAAN MODAL NEGARA REPUBLIK INDONESIA\nKE DALAM MODAL SAHAM PERUSAHAAN PERSEROAN (PERSERO)\nPT PERUSAHAAN LISTRIK NEGARA",
        "Menimbang": {
            "Introduction": "",
            "a": " bahwa untuk memperbaiki struktur permodalan dan\nmeningkatkan kapasitas usaha Perusahaan Perseroan\n(Persero) PT Perusahaan Listrik Negara, perlu\nmelakukan penambahan penyertaan modal Negara\nRepublik Indonesia ke dalam modal saham\nPerusahaan Perseroan (Persero) PT Perusahaan Listrik\nNegara yang berasal dari pengalihan Barang Milik\nNegara pada Kementerian Energi dan Sumber Daya\nMineral yang pengadaannya bersumber dari Anggaran\nPendapatan dan Belanja Negara Tahun Anggaran\n2004, 2005, 2006, dan 2008;",
            "b": " bahwa berdasarkan pertimbangan sebagaimana\ndimaksud dalam huruf a dan untuk melaksanakan\nketentuan Pasal 4 ayat (4) Undang-Undang Nomor 19\nTahun 2003 tentang Badan Usaha Milik Negara, perlu\nmenetapkan Peraturan Pemerintah tentang\nPenambahan Penyertaan Modal Negara Republik"
        },
        "Mengingat": {
            "Introduction": "",
            "1": " Pasal 5 ayat (2) Undang-Undang Dasar Negara Republik Indonesia Tahun 1945;",
            "2": " Undang-Undang Nomor 19 Tahun 2003 tentang Badan Usaha Milik Negara (Lembaran Negara Republik Indonesia Tahun 2003 Nomor 70, Tambahan Lembaran Negara Republik Indonesia Nomor 4297);",
            "3": " Undang-Undang Nomor 1 Tahun 2004 tentang Perbendaharaan Negara (Lembaran Negara Republik Indonesia Tahun 2004 Nomor 5, Tambahan Lembaran Negara Republik Indonesia Nomor 4355);",
            "4": " Undang-Undang Nomor 15 Tahun 2017 tentang Anggaran Pendapatan dan Belanja Negara Tahun Anggaran 2018 (Lembaran Negara Republik Indonesia Tahun 2017 Nomor 233, Tambahan Lembaran Negara Republik Indonesia Nomor 6138);",
            "5": " Peraturan Pemerintah Nomor 44 Tahun 2005 tentang Tata Cara Penyertaan dan Penatausahaan Modal Negara pada Badan Usaha Milik Negara dan Perseroan Terbatas (Lembaran Negara Republik Indonesia Tahun 2005 Nomor 116, Tambahan Lembaran Negara Republik Indonesia Nomor 4555) sebagaimana telah diubah dengan Peraturan Pemerintah Nomor 72 Tahun 2016 tentang Perubahan Atas Peraturan Pemerintah Nomor 44 Tahun 2005 tentang Tata Cara Penyertaan dan Penatausahaan Modal Negara pada Badan Usaha Milik Negara dan Perseroan Terbatas (Lembaran Negara Republik Indonesia Tahun 2016 Nomor 325, Tambahan Lembaran Negara Republik Indonesia Nomor 6006);\nIndonesia ke Dalam Modal Saham Perusahaan Perseroan (Persero) PT Perusahaan Listrik Negara;\n2018, No.71"
        },
        "Menetapkan": "\nPeraturan Pemerintah tentang\nPenambahan Penyertaan Modal Negara Republik\nMengingat  1. Pasal 5 ayat (2) Undang-Undang Dasar Negara Republik Indonesia Tahun 1945;\n2. Undang-Undang Nomor 19 Tahun 2003 tentang Badan Usaha Milik Negara (Lembaran Negara Republik Indonesia Tahun 2003 Nomor 70, Tambahan Lembaran Negara Republik Indonesia Nomor 4297);\n3. Undang-Undang Nomor 1 Tahun 2004 tentang Perbendaharaan Negara (Lembaran Negara Republik Indonesia Tahun 2004 Nomor 5, Tambahan Lembaran Negara Republik Indonesia Nomor 4355);\n4. Undang-Undang Nomor 15 Tahun 2017 tentang Anggaran Pendapatan dan Belanja Negara Tahun Anggaran 2018 (Lembaran Negara Republik Indonesia Tahun 2017 Nomor 233, Tambahan Lembaran Negara Republik Indonesia Nomor 6138);\n5. Peraturan Pemerintah Nomor 44 Tahun 2005 tentang Tata Cara Penyertaan dan Penatausahaan Modal Negara pada Badan Usaha Milik Negara dan Perseroan Terbatas (Lembaran Negara Republik Indonesia Tahun 2005 Nomor 116, Tambahan Lembaran Negara Republik Indonesia Nomor 4555) sebagaimana telah diubah dengan Peraturan Pemerintah Nomor 72 Tahun 2016 tentang Perubahan Atas Peraturan Pemerintah Nomor 44 Tahun 2005 tentang Tata Cara Penyertaan dan Penatausahaan Modal Negara pada Badan Usaha Milik Negara dan Perseroan Terbatas (Lembaran Negara Republik Indonesia Tahun 2016 Nomor 325, Tambahan Lembaran Negara Republik Indonesia Nomor 6006);\nIndonesia ke Dalam Modal Saham Perusahaan Perseroan (Persero) PT Perusahaan Listrik Negara;\n2018, No.71\nMEMUTUSKAN\nMenetapkan PERATURAN PEMERINTAH TENTANG PENAMBAHAN\nPENYERTAAN MODAL NEGARA REPUBLIK INDONESIA KE\nDALAM MODAL SAHAM PERUSAHAAN PERSEROAN\n(PERSERO) PT PERUSAHAAN LISTRIK NEGARA.",
        "tanggal sah": "3 Mei 2018"
    }
}