{
    "results": [
        {
            "id": "56c80acf-7c08-46f6-9f06-ee0fbb6437d4",
            "name": "Article 1",
            "type": "article",
            "children": {
                "id": "b2b5f1c9-589d-488f-a8a2-f0901053a805",
                "name": "Verse 1",
                "number": "(1)",
                "type": "verse",
                "content": "Negara Republik Indonesia melakukan penambahan\npenyertaan modal ke dalam modal saham Perusahaan\nPerseroan (Persero) PT Pindad yang statusnya sebagai\nPerusahaan Perseroan (Persero) ditetapkan berdasarkan\nPeraturan Pemerintah Nomor 52 Tahun 2002 tentang\nPenyertaan Modal Negara Republik Indonesia ke dalam\nModal Saham PT Dirgantara Indonesia, PT PAL Indonesia,\nPT Pindad, PT Dahana, PT Krakatau Steel, PT Barata\nIndonesia, PT Boma Bisma Indra, PT Industri Kereta Api, PT\nIndustri Telekomunikasi Indonesia dan PT LEN Industri dan\nPembubaran Perusahaan Perseroan (Persero) PT Bahana\nPakarya Industri Strategis.",
                "explanation": "Tidak ada Penjelasan"
            }
        },
        {
            "id": "a2464ce4-dee0-41c0-bbfb-19f225db4d0f",
            "name": "Article 2",
            "type": "article",
            "children": {
                "id": "9ec1689b-8426-45d7-a01a-942202957f0b",
                "name": "Verse 1",
                "number": "(1)",
                "type": "verse",
                "content": "(1) Nilai penambahan penyertaan modal Negara\nsebagaimana dimaksud dalam Pasal 1 sebesar\nRp700.000.000.000,00 (tujuh ratus miliar rupiah).\n(2) Penambahan penyertaan modal Negara sebagaimana\ndimaksud pada ayat (1) bersumber dari Anggaran\nPendapatan dan Belanja Negara Tahun Anggaran 2015.",
                "explanation": "Tidak ada Penjelasan"
            }
        },
        {
            "id": "3fa91f74-dfb8-46dd-9880-d7e8db918181",
            "name": "Article 3",
            "type": "article",
            "children": {
                "id": "db317be6-7675-4271-a080-8a7a120684e8",
                "name": "Verse 1",
                "number": "(1)",
                "type": "verse",
                "content": "Peraturan Pemerintah ini mulai berlaku pada tanggal\ndiundangkan.\nAgar setiap orang mengetahuinya, memerintahkan pengundangan Peraturan Pemerintah ini dengan penempatannya dalam Lembaran Negara Republik Indonesia.",
                "explanation": "Tidak ada Penjelasan"
            }
        }
    ],
    "metadata": {
        "Nomor": "120",
        "Tahun": "2015",
        "Tentang": "PENAMBAHAN PENYERTAAN MODAL NEGARA REPUBLIK INDONESIA\nKE DALAM MODAL SAHAM PERUSAHAAN PERSEROAN (PERSERO) PT PINDAD",
        "Menimbang": {
            "Introduction": "",
            "a": " bahwa untuk memperbaiki struktur permodalan dan\nmeningkatkan kapasitas usaha Perusahaan Perseroan\n(Persero) PT Pindad dalam rangka memperkuat industri\nalat utama sistem persenjataan dan produk industri\nlainnya, untuk mendukung Poros Maritim, perlu\nmelakukan penambahan penyertaan modal Negara\nRepublik Indonesia ke dalam modal saham Perusahaan\nPerseroan (Persero) PT Pindad yang bersumber dari\nAnggaran Pendapatan dan Belanja Negara Tahun\nAnggaran 2015;",
            "b": " bahwa berdasarkan pertimbangan sebagaimana\ndimaksud dalam huruf a dan untuk melaksanakan\nketentuan Pasal 4 ayat (4) Undang-Undang Nomor 19\nTahun 2003 tentang Badan Usaha Milik Negara, perlu\nmenetapkan Peraturan Pemerintah tentang\nPenambahan Penyertaan Modal Negara Republik\nIndonesia ke Dalam Modal Saham Perusahaan\nPerseroan (Persero) PT Pindad;\n2015, No.342"
        },
        "Mengingat": {
            "Introduction": "",
            "1": " Pasal 5 ayat (2) Undang-Undang Dasar Negara Republik\nIndonesia Tahun 1945;",
            "2": " Undang-Undang Nomor 19 Tahun 2003 tentang Badan\nUsaha Milik Negara (Lembaran Negara Republik\nIndonesia Tahun 2003 Nomor 70, Tambahan Lembaran\nNegara Republik Indonesia Nomor 4297);",
            "3": " Undang-Undang Nomor 1 Tahun 2004 tentang\nPerbendaharaan Negara (Lembaran Negara Republik\nIndonesia Tahun 2004 Nomor 5, Tambahan Lembaran\nNegara Republik Indonesia Nomor 4355);",
            "4": " Undang-Undang Nomor 27 Tahun 2014 tentang\nAnggaran Pendapatan dan Belanja Negara Tahun\nAnggaran 2015 (Lembaran Negara Republik Indonesia\nTahun 2014 Nomor 259, Tambahan Lembaran Negara\nRepublik Indonesia Nomor 5593) sebagaimana telah\ndiubah dengan Undang-Undang Nomor 3 Tahun 2015\ntentang Perubahan atas Undang-Undang Nomor 27\nTahun 2014 tentang Anggaran Pendapatan dan Belanja\nNegara Tahun Anggaran 2015 (Lembaran Negara\nRepublik Indonesia Tahun 2015 Nomor 44, Tambahan\nLembaran Negara Republik Indonesia Nomor 5669);",
            "5": " Peraturan Pemerintah Nomor 44 Tahun 2005 tentang\nTata Cara Penyertaan dan Penatausahaan Modal\nNegara pada Badan Usaha Milik Negara dan Perseroan\nTerbatas (Lembaran Negara Republik Indonesia Tahun\n2005 Nomor 116, Tambahan Lembaran Negara\nRepublik Indonesia Nomor 4555);"
        },
        "Menetapkan": "\nPeraturan Pemerintah tentang\nPenambahan Penyertaan Modal Negara Republik\nIndonesia ke Dalam Modal Saham Perusahaan\nPerseroan (Persero) PT Pindad;\n2015, No.342\nMengingat  1. Pasal 5 ayat (2) Undang-Undang Dasar Negara Republik\nIndonesia Tahun 1945;\n2. Undang-Undang Nomor 19 Tahun 2003 tentang Badan\nUsaha Milik Negara (Lembaran Negara Republik\nIndonesia Tahun 2003 Nomor 70, Tambahan Lembaran\nNegara Republik Indonesia Nomor 4297);\n3. Undang-Undang Nomor 1 Tahun 2004 tentang\nPerbendaharaan Negara (Lembaran Negara Republik\nIndonesia Tahun 2004 Nomor 5, Tambahan Lembaran\nNegara Republik Indonesia Nomor 4355);\n4. Undang-Undang Nomor 27 Tahun 2014 tentang\nAnggaran Pendapatan dan Belanja Negara Tahun\nAnggaran 2015 (Lembaran Negara Republik Indonesia\nTahun 2014 Nomor 259, Tambahan Lembaran Negara\nRepublik Indonesia Nomor 5593) sebagaimana telah\ndiubah dengan Undang-Undang Nomor 3 Tahun 2015\ntentang Perubahan atas Undang-Undang Nomor 27\nTahun 2014 tentang Anggaran Pendapatan dan Belanja\nNegara Tahun Anggaran 2015 (Lembaran Negara\nRepublik Indonesia Tahun 2015 Nomor 44, Tambahan\nLembaran Negara Republik Indonesia Nomor 5669);\n5. Peraturan Pemerintah Nomor 44 Tahun 2005 tentang\nTata Cara Penyertaan dan Penatausahaan Modal\nNegara pada Badan Usaha Milik Negara dan Perseroan\nTerbatas (Lembaran Negara Republik Indonesia Tahun\n2005 Nomor 116, Tambahan Lembaran Negara\nRepublik Indonesia Nomor 4555);\nMEMUTUSKAN\nMenetapkan  PERATURAN PEMERINTAH TENTANG PENAMBAHAN\nPENYERTAAN MODAL NEGARA REPUBLIK INDONESIA KE\nDALAM MODAL SAHAM PERUSAHAAN PERSEROAN\n(PERSERO) PT PINDAD.",
        "tanggal sah": "23 Desember 2015"
    }
}