{
    "results": [
        {
            "id": "2022cf15-066f-43c8-a969-59ae19763ce3",
            "name": "Article 1",
            "type": "article",
            "children": {
                "id": "88cdc7cb-0ee8-4fed-aeae-4af87bfc6b3f",
                "name": "Verse 1",
                "number": "(1)",
                "type": "verse",
                "content": "Negara Republik Indonesia melakukan penambahan penyertaan modal ke dalam modal saham Perusahaan Perseroan (Persero) PT Dirgantara Indonesia yang statusnya sebagai Perusahaan Perseroan (Persero) ditetapkan berdasarkan Peraturan Pemerintah Nomor 52 Tahun 2002 tentang Penyertaan Modal Negara Republik Indonesia Ke dalam Modal Saham PT Dirgantara Indonesia, PT PAL Indonesia, PT Pindad, PT Dahana, PT Krakatau Steel, PT Barata Indonesia, PT Boma Bisma Indra, PT Industri Kereta Api, PT Industri Telekomunikasi Indonesia dan PT LEN Industri dan Pembubaran Perusahaan Perseroan (Persero) PT Bahana Pakarya Industri Strategis.",
                "explanation": "Tidak ada Penjelasan"
            }
        },
        {
            "id": "346eb345-5b20-4668-8955-a3b282138a0b",
            "name": "Article 2",
            "type": "article",
            "children": {
                "id": "fde2d7ed-ab93-4fa7-8faa-a1a4472b6e9f",
                "name": "Verse 1",
                "number": "(1)",
                "type": "verse",
                "content": "(1) Nilai penambahan penyertaan modal Negara sebagaimana dimaksud dalam Pasal 1 sebesar Rp400.000.000.000,00 (empat ratus miliar rupiah).\n(2) Penambahan penyertaan modal Negara sebagaimana dimaksud pada ayat (1) bersumber dari Anggaran Pendapatan dan Belanja Negara Tahun Anggaran 2015.",
                "explanation": "Tidak ada Penjelasan"
            }
        },
        {
            "id": "91d3491f-b8fd-4d40-b93c-aa4d304aac57",
            "name": "Article 3",
            "type": "article",
            "children": {
                "id": "a45b92df-77f8-42d3-8569-06d24d8ed405",
                "name": "Verse 1",
                "number": "(1)",
                "type": "verse",
                "content": "Peraturan Pemerintah ini mulai berlaku pada tanggal diundangkan.\nAgar setiap orang mengetahuinya, memerintahkan\npengundangan Peraturan Pemerintah ini dengan\npenempatannya dalam Lembaran Negara Republik\nIndonesia.",
                "explanation": "Tidak ada Penjelasan"
            }
        }
    ],
    "metadata": {
        "Nomor": "118",
        "Tahun": "2015",
        "Tentang": "PENAMBAHAN PENYERTAAN MODAL NEGARA REPUBLIK INDONESIA\nKE DALAM MODAL SAHAM PERUSAHAAN PERSEROAN (PERSERO)\nPT DIRGANTARA INDONESIA",
        "Menimbang": {
            "Introduction": "",
            "a": " bahwa untuk memperbaiki struktur permodalan dan\nmeningkatkan kapasitas usaha Perusahaan Perseroan\n(Persero) PT Dirgantara Indonesia dalam rangka\nmendukung industri kedirgantaraan serta industri\npertahanan dan keamanan di bidang maritim, perlu\nmelakukan penambahan penyertaan modal Negara\nRepublik Indonesia ke dalam modal saham\nPerusahaan Perseroan (Persero) PT Dirgantara\nIndonesia yang bersumber dari Anggaran Pendapatan\ndan Belanja Negara Tahun Anggaran 2015;",
            "b": " bahwa berdasarkan pertimbangan sebagaimana\ndimaksud dalam huruf a dan untuk melaksanakan\nketentuan Pasal 4 ayat (4) Undang-Undang Nomor 19\nTahun 2003 tentang Badan Usaha Milik Negara, perlu\nmenetapkan Peraturan Pemerintah tentang\nPenambahan Penyertaan Modal Negara Republik\nIndonesia ke dalam Modal Saham Perusahaan\nPerseroan (Persero) PT Dirgantara Indonesia;"
        },
        "Mengingat": {
            "Introduction": "",
            "1": " Pasal 5 ayat (2) Undang-Undang Dasar Negara\nRepublik Indonesia Tahun 1945;",
            "2": " Undang-Undang Nomor 19 Tahun 2003 tentang Badan\nUsaha Milik Negara (Lembaran Negara Republik\nIndonesia Tahun 2003 Nomor 70, Tambahan\nLembaran Negara Republik Indonesia Nomor 4297);",
            "3": " Undang-Undang Nomor 1 Tahun 2004 tentang\nPerbendaharaan Negara (Lembaran Negara Republik\nIndonesia Tahun 2004 Nomor 5, Tambahan Lembaran\nNegara Republik Indonesia Nomor 4355);",
            "4": " Undang-Undang Nomor 27 Tahun 2014 tentang\nAnggaran Pendapatan dan Belanja Negara Tahun\nAnggaran 2015 (Lembaran Negara Republik Indonesia\nTahun 2014 Nomor 259, Tambahan Lembaran Negara\nRepublik Indonesia Nomor 5593) sebagaimana telah\ndiubah dengan Undang-Undang Nomor 3 Tahun 2015\ntentang Perubahan atas Undang-Undang Nomor 27\nTahun 2014 tentang Anggaran Pendapatan dan\nBelanja Negara Tahun Anggaran 2015 (Lembaran\nNegara Republik Indonesia Tahun 2015 Nomor 44,\nTambahan Lembaran Negara Republik Indonesia\nNomor 5669);",
            "5": " Peraturan Pemerintah Nomor 44 Tahun 2005 tentang\nTata Cara Penyertaan dan Penatausahaan Modal\nNegara pada Badan Usaha Milik Negara dan Perseroan\nTerbatas (Lembaran Negara Republik Indonesia Tahun\n2005 Nomor 116, Tambahan Lembaran Negara\nRepublik Indonesia Nomor 4555);"
        },
        "Menetapkan": "\nPeraturan Pemerintah tentang\nPenambahan Penyertaan Modal Negara Republik\nIndonesia ke dalam Modal Saham Perusahaan\nPerseroan (Persero) PT Dirgantara Indonesia;\nMengingat  1. Pasal 5 ayat (2) Undang-Undang Dasar Negara\nRepublik Indonesia Tahun 1945;\n2. Undang-Undang Nomor 19 Tahun 2003 tentang Badan\nUsaha Milik Negara (Lembaran Negara Republik\nIndonesia Tahun 2003 Nomor 70, Tambahan\nLembaran Negara Republik Indonesia Nomor 4297);\n3. Undang-Undang Nomor 1 Tahun 2004 tentang\nPerbendaharaan Negara (Lembaran Negara Republik\nIndonesia Tahun 2004 Nomor 5, Tambahan Lembaran\nNegara Republik Indonesia Nomor 4355);\n4. Undang-Undang Nomor 27 Tahun 2014 tentang\nAnggaran Pendapatan dan Belanja Negara Tahun\nAnggaran 2015 (Lembaran Negara Republik Indonesia\nTahun 2014 Nomor 259, Tambahan Lembaran Negara\nRepublik Indonesia Nomor 5593) sebagaimana telah\ndiubah dengan Undang-Undang Nomor 3 Tahun 2015\ntentang Perubahan atas Undang-Undang Nomor 27\nTahun 2014 tentang Anggaran Pendapatan dan\nBelanja Negara Tahun Anggaran 2015 (Lembaran\nNegara Republik Indonesia Tahun 2015 Nomor 44,\nTambahan Lembaran Negara Republik Indonesia\nNomor 5669);\n5. Peraturan Pemerintah Nomor 44 Tahun 2005 tentang\nTata Cara Penyertaan dan Penatausahaan Modal\nNegara pada Badan Usaha Milik Negara dan Perseroan\nTerbatas (Lembaran Negara Republik Indonesia Tahun\n2005 Nomor 116, Tambahan Lembaran Negara\nRepublik Indonesia Nomor 4555);\nMEMUTUSKAN\nMenetapkan  PERATURAN PEMERINTAH TENTANG PENAMBAHAN\nPENYERTAAN MODAL NEGARA REPUBLIK INDONESIA KE\nDALAM MODAL SAHAM PERUSAHAAN PERSEROAN\n(PERSERO) PT DIRGANTARA INDONESIA.",
        "tanggal sah": "23 Desember 2015"
    }
}