{
    "results": [
        {
            "id": "de600d61-253e-44ef-b184-50fc39d47a0a",
            "name": "Article 1",
            "type": "article",
            "children": {
                "id": "6ce9b938-d124-456c-8f99-f4bfb981f621",
                "name": "Verse 1",
                "number": "(1)",
                "type": "verse",
                "content": "Negara Republik Indonesia melakukan penambahan\npenyertaan modal ke dalam modal saham Perusahaan\nPerseroan (Persero) PT Perusahaan Listrik Negara yang\n2016, No. 104\nstatusnya sebagai Perusahaan Perseroan (Persero)\nditetapkan berdasarkan Peraturan Pemerintah Nomor 23\nTahun 1994 tentang Pengalihan Bentuk Perusahaan Umum\n(Perum) Listrik Negara menjadi Perusahaan Perseroan\n(Persero).",
                "explanation": "Tidak ada Penjelasan"
            }
        },
        {
            "id": "fc09f330-2b7e-45f7-8d10-c1844205978e",
            "name": "Article 2",
            "type": "article",
            "children": {
                "id": "ee051b85-e9b1-4ee8-836b-01e3e107946b",
                "name": "Verse 1",
                "number": "(1)",
                "type": "verse",
                "content": "(1) Nilai penambahan penyertaan modal Negara\nsebagaimana dimaksud dalam Pasal 1 sebesar\nRp11.159.687.903.416,00 (sebelas triliun seratus lima\npuluh sembilan miliar enam ratus delapan puluh tujuh\njuta sembilan ratus tiga ribu empat ratus enam belas\nrupiah).\n(2) Penambahan penyertaan modal Negara sebagaimana\ndimaksud pada ayat (1) berasal dari pengalihan Barang\nMilik Negara pada Kementerian Energi dan Sumber\nDaya Mineral yang pengadaannya bersumber dari\nAnggaran Pendapatan dan Belanja Negara Tahun\nAnggaran 1994/1995, 1995/1996, 1996/1997,\n1997/1998, 1998/1999, 1999/2000, 2000, 2001,\n2002, 2003, 2004, 2005, 2006, dan 2007 dengan\nrincian sebagaimana tercantum dalam Lampiran yang\nmerupakan bagian tidak terpisahkan dari Peraturan\nPemerintah ini.",
                "explanation": "Tidak ada Penjelasan"
            }
        },
        {
            "id": "44c77524-4320-4174-80c1-c7d10d23dc36",
            "name": "Article 3",
            "type": "article",
            "children": {
                "id": "670cb3bf-a131-4329-81b9-afd7a08d86c8",
                "name": "Verse 1",
                "number": "(1)",
                "type": "verse",
                "content": "Peraturan Pemerintah ini mulai berlaku pada tanggal\ndiundangkan.\nAgar setiap orang mengetahuinya, memerintahkan pengundangan Peraturan Pemerintah ini dengan penempatannya dalam Lembaran Negara Republik Indonesia.",
                "explanation": "Tidak ada Penjelasan"
            }
        }
    ],
    "metadata": {
        "Nomor": "17",
        "Tahun": "2016",
        "Tentang": "PENAMBAHAN PENYERTAAN MODAL NEGARA REPUBLIK INDONESIA\nKE DALAM MODAL SAHAM PERUSAHAAN PERSEROAN (PERSERO)\nPT PERUSAHAAN LISTRIK NEGARA",
        "Menimbang": {
            "Introduction": "",
            "a": " bahwa untuk memperbaiki struktur permodalan dan\nmeningkatkan kapasitas usaha Perusahaan Perseroan\n(Persero) PT Perusahaan Listrik Negara, perlu\nmelakukan penambahan penyertaan modal Negara\nRepublik Indonesia ke dalam modal saham Perusahaan\nPerseroan (Persero) PT Perusahaan Listrik Negara yang\nberasal dari pengalihan Barang Milik Negara pada\nKementerian Energi dan Sumber Daya Mineral yang\npengadaannya bersumber dari Anggaran Pendapatan\ndan Belanja Negara Tahun Anggaran 1994/1995,\n1995/1996, 1996/1997, 1997/1998, 1998/1999,\n1999/2000, 2000, 2001, 2002, 2003, 2004, 2005,\n2006, dan 2007;",
            "b": " bahwa berdasarkan pertimbangan sebagaimana\ndimaksud dalam huruf a dan untuk melaksanakan\nketentuan Pasal 4 ayat (4) Undang-Undang Nomor 19\nTahun 2003 tentang Badan Usaha Milik Negara, perlu\nmenetapkan Peraturan Pemerintah tentang\nPenambahan Penyertaan Modal Negara Republik\nIndonesia ke dalam Modal Saham Perusahaan\nPerseroan (Persero) PT Perusahaan Listrik Negara;"
        },
        "Mengingat": {
            "Introduction": "",
            "1": " Pasal 5 ayat (2) Undang-Undang Dasar Negara\nRepublik Indonesia Tahun 1945;",
            "2": " Undang-Undang Nomor 19 Tahun 2003 tentang Badan\nUsaha Milik Negara (Lembaran Negara Republik\nIndonesia Tahun 2003 Nomor 70, Tambahan Lembaran\nNegara Republik Indonesia Nomor 4297);",
            "3": " Undang-Undang Nomor 1 Tahun 2004 tentang\nPerbendaharaan Negara (Lembaran Negara Republik\nIndonesia Tahun 2004 Nomor 5, Tambahan Lembaran\nNegara Republik Indonesia Nomor 4355);",
            "4": " Undang-Undang Nomor 14 Tahun 2015 tentang\nAnggaran Pendapatan dan Belanja Negara Tahun\nAnggaran 2016 (Lembaran Negara Republik Indonesia\nTahun 2015 Nomor 278, Tambahan Lembaran Negara\nRepublik Indonesia Nomor 5767);",
            "5": " Peraturan Pemerintah Nomor 44 Tahun 2005 tentang\nTata Cara Penyertaan dan Penatausahaan Modal\nNegara pada Badan Usaha Milik Negara dan Perseroan\nTerbatas (Lembaran Negara Republik Indonesia Tahun\n2005 Nomor 116, Tambahan Lembaran Negara\nRepublik Indonesia Nomor 4555);"
        },
        "Menetapkan": "\nPeraturan Pemerintah tentang\nPenambahan Penyertaan Modal Negara Republik\nIndonesia ke dalam Modal Saham Perusahaan\nPerseroan (Persero) PT Perusahaan Listrik Negara;\nMengingat \n1. Pasal 5 ayat (2) Undang-Undang Dasar Negara\nRepublik Indonesia Tahun 1945;\n2. Undang-Undang Nomor 19 Tahun 2003 tentang Badan\nUsaha Milik Negara (Lembaran Negara Republik\nIndonesia Tahun 2003 Nomor 70, Tambahan Lembaran\nNegara Republik Indonesia Nomor 4297);\n3. Undang-Undang Nomor 1 Tahun 2004 tentang\nPerbendaharaan Negara (Lembaran Negara Republik\nIndonesia Tahun 2004 Nomor 5, Tambahan Lembaran\nNegara Republik Indonesia Nomor 4355);\n4. Undang-Undang Nomor 14 Tahun 2015 tentang\nAnggaran Pendapatan dan Belanja Negara Tahun\nAnggaran 2016 (Lembaran Negara Republik Indonesia\nTahun 2015 Nomor 278, Tambahan Lembaran Negara\nRepublik Indonesia Nomor 5767);\n5. Peraturan Pemerintah Nomor 44 Tahun 2005 tentang\nTata Cara Penyertaan dan Penatausahaan Modal\nNegara pada Badan Usaha Milik Negara dan Perseroan\nTerbatas (Lembaran Negara Republik Indonesia Tahun\n2005 Nomor 116, Tambahan Lembaran Negara\nRepublik Indonesia Nomor 4555);\nMEMUTUSKAN\nMenetapkan  PERATURAN PEMERINTAH TENTANG PENAMBAHAN\nPENYERTAAN MODAL NEGARA REPUBLIK INDONESIA KE\nDALAM MODAL SAHAM PERUSAHAAN PERSEROAN\n(PERSERO) PT PERUSAHAAN LISTRIK NEGARA.",
        "tanggal sah": "25 Mei 2016"
    }
}