{
    "results": [
        {
            "id": "5dc82280-acd7-4bc6-b982-0953499fdc76",
            "name": "Article 1",
            "type": "article",
            "children": {
                "id": "4af6c326-e40b-46b3-8906-1e46b4eac74b",
                "name": "Verse 1",
                "number": "(1)",
                "type": "verse",
                "content": "Negara Republik Indonesia melakukan penambahan\npenyertaan modal ke dalam modal saham Perusahaan\nPerseroan (Persero) PT Pelabuhan Indonesia I yang\nstatusnya sebagai Perusahaan Perseroan (Persero)\nditetapkan berdasarkan Peraturan Pemerintah Nomor 56\nTahun 1991 tentang Pengalihan Bentuk Perusahaan Umum\n(Perum) Pelabuhan I Menjadi Perusahaan Perseroan\n(Persero).",
                "explanation": "Tidak ada Penjelasan"
            }
        },
        {
            "id": "ff0d2d79-7482-4429-b4f1-553b7b26aaea",
            "name": "Article 2",
            "type": "article",
            "children": {
                "id": "ac0e24cf-b28c-45c3-af92-023b7b9533b2",
                "name": "Verse 1",
                "number": "(1)",
                "type": "verse",
                "content": "(1) Nilai penambahan penyertaan modal negara\nsebagaimana dimaksud dalam Pasal 1 sebesar\nRp527.133.217.252,50 (lima ratus dua puluh tujuh\nmiliar seratus tiga puluh tiga juta dua ratus tujuh\nbelas ribu dua ratus lima puluh dua rupiah lima\npuluh sen).\n(2) Penambahan penyertaan modal negara sebagaimana\ndimaksud pada ayat (1) berasal dari pengalihan\nBarang Milik Negara pada Kementerian Perhubungan\nyang pengadaannya bersumber dari Anggaran\nPendapatan dan Belanja Negara Tahun Anggaran\n2000, 2001, 2002, 2003, 2004, 2005, 2006, 2007,\n2008, 2009, 2010, dan 2011 dengan rincian\nsebagaimana tercantum dalam Lampiran yang\nmerupakan bagian tidak terpisahkan dari Peraturan\nPemerintah ini.",
                "explanation": "Tidak ada Penjelasan"
            }
        },
        {
            "id": "18e39171-fb0f-4a82-9391-5ecacc5def01",
            "name": "Article 3",
            "type": "article",
            "children": {
                "id": "4dfbf0be-8341-49c7-bc4b-57ae3d85d476",
                "name": "Verse 1",
                "number": "(1)",
                "type": "verse",
                "content": "Peraturan Pemerintah ini mulai berlaku pada tanggal\ndiundangkan.\nAgar setiap orang mengetahuinya, memerintahkan\npengundangan Peraturan Pemerintah ini dengan\npenempatannya dalam Lembaran Negara Republik\nIndonesia.",
                "explanation": "Tidak ada Penjelasan"
            }
        }
    ],
    "metadata": {
        "Nomor": "10",
        "Tahun": "2019",
        "Tentang": "PENAMBAHAN PENYERTAAN MODAL NEGARA REPUBLIK INDONESIA\nKE DALAM MODAL SAHAM PERUSAHAAN PERSEROAN (PERSERO)\nPT PELABUHAN INDONESIA I",
        "Menimbang": {
            "Introduction": "",
            "a": " bahwa untuk memperbaiki struktur permodalan\nPerusahaan Perseroan (Persero) PT Pelabuhan\nIndonesia I, perlu melakukan penambahan penyertaan\nmodal Negara Republik Indonesia ke dalam modal\nsaham Perusahaan Perseroan (Persero) PT Pelabuhan\nIndonesia I yang berasal dari pengalihan Barang Milik\nNegara pada Kementerian Perhubungan yang\npengadaannya bersumber dari Anggaran Pendapatan\ndan Belanja Negara Tahun Anggaran 2000, 2001,\n2002, 2003, 2004, 2005, 2006, 2007, 2008, 2009,\n2010, dan 2011;",
            "b": " bahwa berdasarkan pertimbangan sebagaimana\ndimaksud dalam huruf a dan untuk melaksanakan\nketentuan Pasal 4 ayat (4) Undang-Undang Nomor 19\nTahun 2003 tentang Badan Usaha Milik Negara, perlu\nmenetapkan Peraturan Pemerintah tentang\nPenambahan Penyertaan Modal Negara Republik"
        },
        "Mengingat": {
            "Introduction": "",
            "1": " Pasal 5 ayat (2) Undang-Undang Dasar Negara Republik Indonesia Tahun 1945;",
            "2": " Undang-Undang Nomor 19 Tahun 2003 tentang Badan Usaha Milik Negara (Lembaran Negara Republik Indonesia Tahun 2003 Nomor 70, Tambahan Lembaran Negara Republik Indonesia Nomor 4297);",
            "3": " Undang-Undang Nomor 1 Tahun 2004 tentang Perbendaharaan Negara (Lembaran Negara Republik Indonesia Tahun 2004 Nomor 5, Tambahan Lembaran Negara Republik Indonesia Nomor 4355);",
            "4": " Undang-Undang Nomor 12 Tahun 2018 tentang Anggaran Pendapatan dan Belanja Negara Tahun Anggaran 2019 (Lembaran Negara Republik Indonesia Tahun 2018 Nomor 223, Tambahan Lembaran Negara Republik Indonesia Nomor 6263);",
            "5": " Peraturan Pemerintah Nomor 44 Tahun 2005 tentang Tata Cara Penyertaan dan Penatausahaan Modal Negara pada Badan Usaha Milik Negara dan Perseroan Terbatas (Lembaran Negara Republik Indonesia Tahun 2005 Nomor 116, Tambahan Lembaran Negara Republik Indonesia Nomor 4555) sebagaimana telah diubah dengan Peraturan Pemerintah Nomor 72 Tahun 2016 tentang Perubahan Atas Peraturan Pemerintah Nomor 44 Tahun 2005 tentang Tata Cara Penyertaan dan Penatausahaan Modal Negara pada Badan Usaha Milik Negara dan Perseroan Terbatas (Lembaran Negara Republik Indonesia Tahun 2016 Nomor 325, Tambahan Lembaran Negara Republik Indonesia Nomor 6006);\n2019, No.38"
        },
        "Menetapkan": "\nPeraturan Pemerintah tentang\nPenambahan Penyertaan Modal Negara Republik\nMengingat \n1. Pasal 5 ayat (2) Undang-Undang Dasar Negara Republik Indonesia Tahun 1945;\n2. Undang-Undang Nomor 19 Tahun 2003 tentang Badan Usaha Milik Negara (Lembaran Negara Republik Indonesia Tahun 2003 Nomor 70, Tambahan Lembaran Negara Republik Indonesia Nomor 4297);\n3. Undang-Undang Nomor 1 Tahun 2004 tentang Perbendaharaan Negara (Lembaran Negara Republik Indonesia Tahun 2004 Nomor 5, Tambahan Lembaran Negara Republik Indonesia Nomor 4355);\n4. Undang-Undang Nomor 12 Tahun 2018 tentang Anggaran Pendapatan dan Belanja Negara Tahun Anggaran 2019 (Lembaran Negara Republik Indonesia Tahun 2018 Nomor 223, Tambahan Lembaran Negara Republik Indonesia Nomor 6263);\n5. Peraturan Pemerintah Nomor 44 Tahun 2005 tentang Tata Cara Penyertaan dan Penatausahaan Modal Negara pada Badan Usaha Milik Negara dan Perseroan Terbatas (Lembaran Negara Republik Indonesia Tahun 2005 Nomor 116, Tambahan Lembaran Negara Republik Indonesia Nomor 4555) sebagaimana telah diubah dengan Peraturan Pemerintah Nomor 72 Tahun 2016 tentang Perubahan Atas Peraturan Pemerintah Nomor 44 Tahun 2005 tentang Tata Cara Penyertaan dan Penatausahaan Modal Negara pada Badan Usaha Milik Negara dan Perseroan Terbatas (Lembaran Negara Republik Indonesia Tahun 2016 Nomor 325, Tambahan Lembaran Negara Republik Indonesia Nomor 6006);\n2019, No.38\nMEMUTUSKAN\nMenetapkan PERATURAN PEMERINTAH TENTANG PENAMBAHAN\nPENYERTAAN MODAL NEGARA REPUBLIK INDONESIA KE\nDALAM MODAL SAHAM PERUSAHAAN PERSEROAN\n(PERSERO) PT PELABUHAN INDONESIA I.",
        "tanggal sah": "22 Februari 2019"
    }
}